<?xml version="1.0" encoding="UTF-8"?>

<custom-attributes 
	xmlns="http://ez.no/crowd/ldap.custom-attributes.xsd"
	xmlns:xsi="http://www.w3.org/2001/XMLSchema-instance"
	xsi:schemaLocation="http://ez.no/crowd/ldap.custom-attributes.xsd http://ez.no/crowd/ldap.custom-attributes.xsd">
	
	<directory name="Community LDAP"> 
		<server>http://sdfasdf.no:8000</server>
		<server></server>
		<user>
			<attribute key="displayName" type="STRING">
				<ldap-name>displayName</ldap-name>
			</attribute>
			<attribute key="photo" type="BINARY">
				<ldap-name>jpegPhoto-updated</ldap-name>
			</attribute>
		</user>
		<group>
		</group>
	</directory>
</custom-attributes>