<?xml version="1.0" encoding="UTF-8"?>

<custom-attributes 
	xmlns="http://ez.no/crowd/ldap.custom-attributes.xsd"
	xmlns:xsi="http://www.w3.org/2001/XMLSchema-instance"
	xsi:schemaLocation="http://ez.no/crowd/ldap.custom-attributes.xsd http://ez.no/crowd/ldap.custom-attributes.xsd">
  	  
	<directory name="Community LDAP"> 
		<server>http://sdfasdf.no:8000</server>
		<server>123456789</server>
		<user>
			<attribute key="displayName" type="STRING">
				<ldap-name>displayName</ldap-name>
			</attribute>
			<attribute key="photo" type="BINARY">
				<ldap-name>jpegPhoto</ldap-name>
			</attribute>
			<attribute key="description" type="STRING">
				<ldap-name>description</ldap-name>
			</attribute>
			<attribute key="labeledURI" type="STRING">
				<ldap-name>labeledURI</ldap-name>
			</attribute>
			<attribute key="title" type="STRING">
				<ldap-name>title</ldap-name>
			</attribute>
			<attribute key="someInt" type="INTEGER">
				<ldap-name>int</ldap-name>
			</attribute>
			<attribute key="someDouble" type="DOUBLE">
				<ldap-name>double</ldap-name>
			</attribute>
			<attribute key="created" type="DATETIME" operational="true">
				<ldap-name>createTime</ldap-name>
			</attribute>
			<attribute key="createdXml" type="DATETIME">
				<ldap-name>created</ldap-name>
				<format pattern="yyyy-MM-dd'T'kk:mm:ssZ" time-zone="+01:00"/>
				<format pattern="yyyy-MM-dd'T'kk:mm:ss"/>
			</attribute>
		</user>
		<group>
			<attribute key="groupName" type="STRING">
				<ldap-name>displayName</ldap-name>
			</attribute>
			<attribute key="created" type="DATETIME" operational="true">
				<ldap-name>createTime</ldap-name>
			</attribute>
			<attribute key="modified" type="DATETIME" operational="true">
				<ldap-name>modifyTime</ldap-name>
			</attribute>
		</group>
	</directory>
</custom-attributes>